id,optionId,sortOrder,sourceName,targetName,surfaceRelation,hiddenTension,conflictSource,secretAsymmetry,dynamicLabel,nextTurnPoint,createdAt,updatedAt
cmr23zj2f004gv16z85y366aj,cmr23zj2b0049v16z9393m9wv,0,阿条,阿力,普通同事，在办公室保持距离,秘密恋人，私下极度亲密，但阿条对阿力的真心充满怀疑,信任缺失与公司禁忌的双重压力,阿力隐藏着不愿承诺的真实想法，阿条隐藏着内心的不安,虐恋拉扯,一次暴露危机后，阿力是否会选择公开或逃避,2026-07-01T13:26:02.050+00:00,2026-07-01T13:26:02.050+00:00
cmr23zj2f004hv16z7ry7j7gn,cmr23zj2b0049v16z9393m9wv,1,阿条,李晴,好闺蜜，无话不谈的同事,阿条向李晴隐瞒恋情，李晴隐约察觉异常却未被坦白,友谊与秘密的冲突,阿条隐藏着恋情，李晴隐藏着对阿力的短暂好感,信任与隐瞒,李晴发现蛛丝马迹后当面质问阿条,2026-07-01T13:26:02.050+00:00,2026-07-01T13:26:02.050+00:00
cmr23zj2f004iv16zmg5rzr3h,cmr23zj2b0049v16z9393m9wv,2,阿力,小菲,关系不错的同事，经常互相调侃,暧昧试探，小菲有意靠近，阿力不主动不拒绝,阿力的游离态度与小菲的征服欲,小菲不知道阿条阿力已经在一起，阿力享受这种关注,暧昧竞争,小菲故意在阿条面前表现出与阿力的亲密,2026-07-01T13:26:02.050+00:00,2026-07-01T13:26:02.050+00:00
cmr23zj2f004jv16z5dqg98er,cmr23zj2b0049v16z9393m9wv,3,阿条,王总,上下级，服从公司管理,王总已对两人关系生疑，正在观察；阿条恐惧被识破,制度与个人情感的对抗,王总隐藏调查意图，阿条隐藏恋情,监控与反监控,王总收到匿名举报，决定约谈两人,2026-07-01T13:26:02.050+00:00,2026-07-01T13:26:02.050+00:00
cmr23zj2f004kv16zymx5wd5r,cmr23zj2b0049v16z9393m9wv,4,阿条,陈默,前同事，偶尔问候的朋友,陈默曾有未表露的好感，阿条在他离开后感到失落,错过的时间与未说出口的话,陈默知道自己的心意但没说，阿条不知道他的好感,遗憾与怀念,陈默回杭州出差，得知阿条近况后决定是否表露心声,2026-07-01T13:26:02.050+00:00,2026-07-01T13:26:02.050+00:00
