id,optionId,sortOrder,name,role,gender,castRole,relationToProtagonist,storyFunction,shortDescription,personality,background,development,identityLabel,factionLabel,stanceLabel,powerLevel,realm,currentLocation,availability,prohibitionsJson,outerGoal,innerNeed,fear,wound,misbelief,secret,moralLine,firstImpression,createdAt,updatedAt
cmr23zj2d004av16z9gkr1sfn,cmr23zj2b0049v16z9393m9wv,0,阿条,女主角,female,protagonist,,第一视角的体验者，内心世界的挣扎者，秘密恋情的发起者和承受者,一个刚毕业从北京来杭州工作的女孩，热情浪漫却害怕受伤，陷入与同事的禁忌之恋。,白羊座ENFP，外向活泼，敢爱敢恨，但在感情中容易自我催眠，敏感且需要安全感。,在北京生活了十年后，独自来到杭州进入互联网公司，对这座城市原本无感，直到遇见阿力。,从主动追求爱情的天真，到逐渐看清关系的不平等与自我欺骗，最终学会划定界限，完成自我成长。,公司职员,运营部,普通员工,,,杭州，公司办公室/出租屋,可随时出场,"[""禁止同组恋爱""]",在杭州站稳脚跟，拥有属于自己的生活,被真正地爱与选择，获得安全感和归属,害怕投入的感情被轻视，害怕自己只是一厢情愿,曾经在感情中受过伤，害怕再次被伤害,以为只要自己足够好，就能换来真心,她与阿力的秘密恋情,不愿伤害朋友，陷入隐瞒的愧疚,阳光开朗的女孩，有点天真，但对人真诚,2026-07-01T13:26:02.050+00:00,2026-07-01T13:26:02.050+00:00
cmr23zj2d004bv16z8ay82j8y,cmr23zj2b0049v16z9393m9wv,1,阿力,男主角,male,love_interest,秘密恋人，同组同事,秘密恋情的另一核心，提供情感张力与矛盾，他的模糊态度是虐心感的主要来源,阿条的同事，外表随和，善于人际，但内心有距离感，对感情不确定。,表面温和无害，社交能力强，但在感情中显得游刃有余，有些中央空调特质，内心深处缺乏承诺勇气。,在杭州工作几年，是公司老员工，与同事们关系融洽，但私生活成谜。,从享受秘密关系的刺激，到面对阿条的期待和压力，最终需要在责任和逃避间做出选择，他的选择将决定关系走向。,公司职员,运营部,普通员工,,,杭州，公司办公室,工作日及与阿条私下见面,"[""禁止同组恋爱""]",维持职场安稳，享受生活,渴望亲密但又恐惧束缚,害怕承诺带来的责任，害怕失去自由,过往的感情经历让他对亲密关系保持警惕,以为不明确关系就不会伤害别人,他对每段关系都保持暧昧，并不觉得自己能专一,不会主动伤害，但会因回避而伤人,温和好说话，有点神秘，似乎对谁都好,2026-07-01T13:26:02.050+00:00,2026-07-01T13:26:02.050+00:00
cmr23zj2d004cv16zvroyntme,cmr23zj2b0049v16z9393m9wv,2,李晴,阿条的好友兼同事,female,ally,知心好友，无话不谈，但不知情秘密恋情,提供情感支持与日常陪伴，同时也是职场舆论的晴雨表，增加阿条隐瞒的压力,阿条入职后最早结识的朋友，性格仗义，八卦但可靠，对办公室恋情敏感。,豪爽直率，乐于助人，喜欢八卦但守口如瓶，正义感强。,在杭州工作数年，是办公室的消息灵通人士，与阿条一见如故。,从好友到逐渐发现阿条与阿力的蛛丝马迹，面临是否捅破的抉择，可能成为关键时刻的推手。,公司职员,运营部,普通员工,,,杭州，公司办公室,工作日常在场,[],做好工作，享受小资生活,希望朋友幸福，但也坚守原则,害怕朋友受伤害,曾因闺蜜的秘密恋情而友谊破裂,,也曾短暂对阿力有过好感,不会主动拆散，但若发现会要求解释,开朗仗义，办公室的开心果,2026-07-01T13:26:02.050+00:00,2026-07-01T13:26:02.050+00:00
cmr23zj2d004dv16zznmusp6k,cmr23zj2b0049v16z9393m9wv,3,王总,部门主管,male,pressure_source,上级，规则的执行者,代表公司制度与职场压力，他的存在时刻提醒禁忌，也可能成为秘密曝光的引爆点,严肃但公正的部门主管，对办公室恋情零容忍，察觉力强。,严谨刻板，重视规则和效率，私下并不冷血，但工作上不容沙子。,从基层做起，因能力晋升，对团队要求严格，有段失败的办公室恋情经历。,从不知情到逐渐起疑，若证实将按规章处理，是阿条和阿力头上的达摩克利斯之剑。,部门主管,管理层,规则捍卫者,部门决策权,,公司办公室,工作日在岗,"[""禁止下级同组恋爱""]",带领团队完成业绩，维护部门秩序,避免重蹈覆辙，保证团队稳定,怕因个人情感影响职业判断,曾经因为办公室恋情导致团队分裂,认为办公室恋情必然危害工作,他私下关注阿条和阿力，已在酝酿调查,按章办事，偶有恻隐,严肃冷静，让人敬畏,2026-07-01T13:26:02.050+00:00,2026-07-01T13:26:02.050+00:00
cmr23zj2d004ev16zpvxcblgh,cmr23zj2b0049v16z9393m9wv,4,陈默,离职的前同事朋友,male,catalyst,前同事，曾为团队核心，阿条信赖的朋友,作为已离开的人，他代表了阿条初到杭州时的美好时光，他的离去加速了阿条的孤独，也间接促使她靠近阿力,阿条在杭州最早认下的朋友之一，性格沉稳，有理想，因发展离职启发了阿条对未来的思考。,内敛有担当，喜欢思考，是个可靠的倾听者。,与阿条同时期入职，是团队里最照顾她的人，后因个人追求跳槽。,他的离开让阿条在团队中更依赖阿力，后续可能以外部视角出现，提供另一种人生选择。,前同事,已离开，无阵营,观察者,,,上海（新公司）,偶尔线上联系，或关键剧情出现,[],实现职业理想,保持真诚和原则,在庸庸碌碌中迷失,,,他曾对阿条有过朦胧好感，但未表露,坚守本心,沉稳可靠，不善言辞但有温度,2026-07-01T13:26:02.050+00:00,2026-07-01T13:26:02.050+00:00
cmr23zj2d004fv16zip529k5q,cmr23zj2b0049v16z9393m9wv,5,小菲,团队里另一位女同事,female,foil,表面和气，暗地里对阿力有好感，无形中给阿条带来比较和压力,作为对照，映衬阿条的热情直率，同时是阿条不安的来源之一，她的存在令阿条时常猜疑阿力,精致时髦，擅长交际，与阿力关系密切，喜欢暧昧游戏。,外表甜美，内心精明，享受被关注，对竞争者隐晦打压。,本地人，家境优渥，工作能力平平但人际关系好。,从无害同事到逐渐察觉阿条阿力关系，可能故意试探或制造误会，加剧虐心,公司职员,运营部,普通员工,,,公司,日常在岗,[],维持社交女王形象，找到优质男友,渴望被独特偏爱,被人看穿浅薄,曾被忽略不被选择,认为魅力可以掌控一切,她其实知道阿力并不专一，但仍想征服,为达目的会耍小心机,时髦漂亮，嘴甜会撒娇,2026-07-01T13:26:02.050+00:00,2026-07-01T13:26:02.050+00:00
